Sheet: x_y_coords
A1: time (secs) | B1: x coords | C1: y coords | D1: input | E1: diff_time(sec) | F1: x_diff | G1: y_diff | H1: x_diff/diff_time | I1: y_diff/diff_time
A2: 0 | B2: 0 | C2: 0 | D2: yellow.mkv | E2: of:=[.A3]-[.A2] -> 4 | F2: of:=[.B3]-[.B2] -> 600 | G2: of:=[.C3]-[.C2] -> 600 | H2: of:=[.F2]/[.E2] -> 150 | I2: of:=[.G2]/[.E2] -> 150 | K2: of:="x="&[.B2]&"+(t-"&[.A2]&")*"&ROUND([.H2];3)&":" -> x=0+(t-0)*150: | L2: of:="y="&[.C2]&"+(t-"&[.A2]&")*"&ROUND([.I2];3)&":" -> y=0+(t-0)*150:
A3: 4 | B3: 600 | C3: 600 | D3: pink.mkv | E3: of:=[.A4]-[.A3] -> 3 | F3: of:=[.B4]-[.B3] -> -300 | G3: of:=[.C4]-[.C3] -> -400 | H3: of:=[.F3]/[.E3] -> -100 | I3: of:=[.G3]/[.E3] -> -133.333333333333 | K3: of:="x="&[.B3]&"+(t-"&[.A3]&")*"&ROUND([.H3];3)&":" -> x=600+(t-4)*-100: | L3: of:="y="&[.C3]&"+(t-"&[.A3]&")*"&ROUND([.I3];3)&":" -> y=600+(t-4)*-133.333:
A4: 7 | B4: 300 | C4: 200 | D4: blue.mkv | E4: of:=[.A5]-[.A4] -> 3 | F4: of:=[.B5]-[.B4] -> -200 | G4: of:=[.C5]-[.C4] -> -100 | H4: of:=[.F4]/[.E4] -> -66.6666666666667 | I4: of:=[.G4]/[.E4] -> -33.3333333333333 | K4: of:="x="&[.B4]&"+(t-"&[.A4]&")*"&ROUND([.H4];3)&":" -> x=300+(t-7)*-66.667: | L4: of:="y="&[.C4]&"+(t-"&[.A4]&")*"&ROUND([.I4];3)&":" -> y=200+(t-7)*-33.333:
A5: 10 | B5: 100 | C5: 100 | D5: yellow.mkv | E5: of:=[.A6]-[.A5] -> 3 | F5: of:=[.B6]-[.B5] -> 0 | G5: of:=[.C6]-[.C5] -> 400 | H5: of:=[.F5]/[.E5] -> 0 | I5: of:=[.G5]/[.E5] -> 133.333333333333 | K5: of:="x="&[.B5]&"+(t-"&[.A5]&")*"&ROUND([.H5];3)&":" -> x=100+(t-10)*0: | L5: of:="y="&[.C5]&"+(t-"&[.A5]&")*"&ROUND([.I5];3)&":" -> y=100+(t-10)*133.333:
A6: 13 | B6: 100 | C6: 500 | D6: yellow.mkv | E6: of:=[.A7]-[.A6] -> 3 | F6: of:=[.B7]-[.B6] -> 500 | G6: of:=[.C7]-[.C6] -> 0 | H6: of:=[.F6]/[.E6] -> 166.666666666667 | I6: of:=[.G6]/[.E6] -> 0 | K6: of:="x="&[.B6]&"+(t-"&[.A6]&")*"&ROUND([.H6];3)&":" -> x=100+(t-13)*166.667: | L6: of:="y="&[.C6]&"+(t-"&[.A6]&")*"&ROUND([.I6];3)&":" -> y=500+(t-13)*0:
A7: 16 | B7: 600 | C7: 500 | D7: yellow.mkv | E7: of:=[.A8]-[.A7] -> 2 | F7: of:=[.B8]-[.B7] -> -100 | G7: of:=[.C8]-[.C7] -> -100 | H7: of:=[.F7]/[.E7] -> -50 | I7: of:=[.G7]/[.E7] -> -50 | K7: of:="x="&[.B7]&"+(t-"&[.A7]&")*"&ROUND([.H7];3)&":" -> x=600+(t-16)*-50: | L7: of:="y="&[.C7]&"+(t-"&[.A7]&")*"&ROUND([.I7];3)&":" -> y=500+(t-16)*-50:
A8: 18 | B8: 500 | C8: 400 | D8: yellow.mkv | E8: of:=[.A9]-[.A8] -> 4 | F8: of:=[.B9]-[.B8] -> -200 | G8: of:=[.C9]-[.C8] -> -200 | H8: of:=[.F8]/[.E8] -> -50 | I8: of:=[.G8]/[.E8] -> -50 | K8: of:="x="&[.B8]&"+(t-"&[.A8]&")*"&ROUND([.H8];3)&":" -> x=500+(t-18)*-50: | L8: of:="y="&[.C8]&"+(t-"&[.A8]&")*"&ROUND([.I8];3)&":" -> y=400+(t-18)*-50:
A9: 22 | B9: 300 | C9: 200 | D9: yellow.mkv | E9: of:=[.A10]-[.A9] -> 3 | F9: of:=[.B10]-[.B9] -> 100 | G9: of:=[.C10]-[.C9] -> -100 | H9: of:=[.F9]/[.E9] -> 33.3333333333333 | I9: of:=[.G9]/[.E9] -> -33.3333333333333 | K9: of:="x="&[.B9]&"+(t-"&[.A9]&")*"&ROUND([.H9];3)&":" -> x=300+(t-22)*33.333: | L9: of:="y="&[.C9]&"+(t-"&[.A9]&")*"&ROUND([.I9];3)&":" -> y=200+(t-22)*-33.333:
A10: 25 | B10: 400 | C10: 100 | D10: yellow.mkv | E10: of:=[.A11]-[.A10] -> 3 | F10: of:=[.B11]-[.B10] -> -150 | G10: of:=[.C11]-[.C10] -> 0 | H10: of:=[.F10]/[.E10] -> -50 | I10: of:=[.G10]/[.E10] -> 0 | K10: of:="x="&[.B10]&"+(t-"&[.A10]&")*"&ROUND([.H10];3)&":" -> x=400+(t-25)*-50: | L10: of:="y="&[.C10]&"+(t-"&[.A10]&")*"&ROUND([.I10];3)&":" -> y=100+(t-25)*0:
A11: 28 | B11: 250 | C11: 100 | D11: yellow.mkv | E11: of:=[.A12]-[.A11] -> 3 | F11: of:=[.B12]-[.B11] -> -150 | G11: of:=[.C12]-[.C11] -> 400 | H11: of:=[.F11]/[.E11] -> -50 | I11: of:=[.G11]/[.E11] -> 133.333333333333 | K11: of:="x="&[.B11]&"+(t-"&[.A11]&")*"&ROUND([.H11];3)&":" -> x=250+(t-28)*-50: | L11: of:="y="&[.C11]&"+(t-"&[.A11]&")*"&ROUND([.I11];3)&":" -> y=100+(t-28)*133.333:
A12: 31 | B12: 100 | C12: 500 | D12: yellow.mkv | E12: of:=[.A13]-[.A12] -> 1 | F12: of:=[.B13]-[.B12] -> 200 | G12: of:=[.C13]-[.C12] -> 100 | H12: of:=[.F12]/[.E12] -> 200 | I12: of:=[.G12]/[.E12] -> 100 | K12: of:="x="&[.B12]&"+(t-"&[.A12]&")*"&ROUND([.H12];3)&":" -> x=100+(t-31)*200: | L12: of:="y="&[.C12]&"+(t-"&[.A12]&")*"&ROUND([.I12];3)&":" -> y=500+(t-31)*100:
A13: 32 | B13: 300 | C13: 600 | D13: yellow.mkv | E13: of:=[.A14]-[.A13] -> 2 | F13: of:=[.B14]-[.B13] -> 600 | G13: of:=[.C14]-[.C13] -> -400 | H13: of:=[.F13]/[.E13] -> 300 | I13: of:=[.G13]/[.E13] -> -200 | K13: of:="x="&[.B13]&"+(t-"&[.A13]&")*"&ROUND([.H13];3)&":" -> x=300+(t-32)*300: | L13: of:="y="&[.C13]&"+(t-"&[.A13]&")*"&ROUND([.I13];3)&":" -> y=600+(t-32)*-200:
A14: 34 | B14: 900 | C14: 200 | D14: yellow.mkv | E14: of:=[.A15]-[.A14] -> 2 | F14: of:=[.B15]-[.B14] -> -300 | G14: of:=[.C15]-[.C14] -> -100 | H14: of:=[.F14]/[.E14] -> -150 | I14: of:=[.G14]/[.E14] -> -50 | K14: of:="x="&[.B14]&"+(t-"&[.A14]&")*"&ROUND([.H14];3)&":" -> x=900+(t-34)*-150: | L14: of:="y="&[.C14]&"+(t-"&[.A14]&")*"&ROUND([.I14];3)&":" -> y=200+(t-34)*-50:
A15: 36 | B15: 600 | C15: 100 | D15: yellow.mkv | E15: of:=[.A16]-[.A15] -> 2 | F15: of:=[.B16]-[.B15] -> 400 | G15: of:=[.C16]-[.C15] -> 700 | H15: of:=[.F15]/[.E15] -> 200 | I15: of:=[.G15]/[.E15] -> 350 | K15: of:="x="&[.B15]&"+(t-"&[.A15]&")*"&ROUND([.H15];3)&":" -> x=600+(t-36)*200: | L15: of:="y="&[.C15]&"+(t-"&[.A15]&")*"&ROUND([.I15];3)&":" -> y=100+(t-36)*350:
A16: 38 | B16: 1000 | C16: 800 | D16: yellow.mkv | E16: of:=[.A17]-[.A16] -> 2 | F16: of:=[.B17]-[.B16] -> 800 | G16: of:=[.C17]-[.C16] -> 200 | H16: of:=[.F16]/[.E16] -> 400 | I16: of:=[.G16]/[.E16] -> 100 | K16: of:="x="&[.B16]&"+(t-"&[.A16]&")*"&ROUND([.H16];3)&":" -> x=1000+(t-38)*400: | L16: of:="y="&[.C16]&"+(t-"&[.A16]&")*"&ROUND([.I16];3)&":" -> y=800+(t-38)*100:
A17: 40 | B17: 1800 | C17: 1000 | D17: yellow.mkv | E17: of:=[.A18]-[.A17] -> 2 | F17: of:=[.B18]-[.B17] -> -1700 | G17: of:=[.C18]-[.C17] -> -990 | H17: of:=[.F17]/[.E17] -> -850 | I17: of:=[.G17]/[.E17] -> -495 | K17: of:="x="&[.B17]&"+(t-"&[.A17]&")*"&ROUND([.H17];3)&":" -> x=1800+(t-40)*-850: | L17: of:="y="&[.C17]&"+(t-"&[.A17]&")*"&ROUND([.I17];3)&":" -> y=1000+(t-40)*-495:
A18: 42 | B18: 100 | C18: 10 | D18: yellow.mkv | E18: of:=[.A19]-[.A18] -> 2 | F18: of:=[.B19]-[.B18] -> 1400 | G18: of:=[.C19]-[.C18] -> 890 | H18: of:=[.F18]/[.E18] -> 700 | I18: of:=[.G18]/[.E18] -> 445 | K18: of:="x="&[.B18]&"+(t-"&[.A18]&")*"&ROUND([.H18];3)&":" -> x=100+(t-42)*700: | L18: of:="y="&[.C18]&"+(t-"&[.A18]&")*"&ROUND([.I18];3)&":" -> y=10+(t-42)*445:
A19: 44 | B19: 1500 | C19: 900 | D19: yellow.mkv | E19: of:=[.A20]-[.A19] -> 2 | F19: of:=[.B20]-[.B19] -> -1300 | G19: of:=[.C20]-[.C19] -> -890 | H19: of:=[.F19]/[.E19] -> -650 | I19: of:=[.G19]/[.E19] -> -445 | K19: of:="x="&[.B19]&"+(t-"&[.A19]&")*"&ROUND([.H19];3)&":" -> x=1500+(t-44)*-650: | L19: of:="y="&[.C19]&"+(t-"&[.A19]&")*"&ROUND([.I19];3)&":" -> y=900+(t-44)*-445:
A20: 46 | B20: 200 | C20: 10 | D20: yellow.mkv | E20: of:=[.A21]-[.A20] -> 2 | F20: of:=[.B21]-[.B20] -> 100 | G20: of:=[.C21]-[.C20] -> 190 | H20: of:=[.F20]/[.E20] -> 50 | I20: of:=[.G20]/[.E20] -> 95 | K20: of:="x="&[.B20]&"+(t-"&[.A20]&")*"&ROUND([.H20];3)&":" -> x=200+(t-46)*50: | L20: of:="y="&[.C20]&"+(t-"&[.A20]&")*"&ROUND([.I20];3)&":" -> y=10+(t-46)*95:
A21: 48 | B21: 300 | C21: 200 | D21: yellow.mkv | E21: of:=[.A22]-[.A21] -> 2 | F21: of:=[.B22]-[.B21] -> 300 | G21: of:=[.C22]-[.C21] -> 600 | H21: of:=[.F21]/[.E21] -> 150 | I21: of:=[.G21]/[.E21] -> 300 | K21: of:="x="&[.B21]&"+(t-"&[.A21]&")*"&ROUND([.H21];3)&":" -> x=300+(t-48)*150: | L21: of:="y="&[.C21]&"+(t-"&[.A21]&")*"&ROUND([.I21];3)&":" -> y=200+(t-48)*300:
A22: 50 | B22: 600 | C22: 800 | D22: yellow.mkv | E22: of:=[.A23]-[.A22] -> 2 | F22: of:=[.B23]-[.B22] -> 300 | G22: of:=[.C23]-[.C22] -> -500 | H22: of:=[.F22]/[.E22] -> 150 | I22: of:=[.G22]/[.E22] -> -250 | K22: of:="x="&[.B22]&"+(t-"&[.A22]&")*"&ROUND([.H22];3)&":" -> x=600+(t-50)*150: | L22: of:="y="&[.C22]&"+(t-"&[.A22]&")*"&ROUND([.I22];3)&":" -> y=800+(t-50)*-250:
A23: 52 | B23: 900 | C23: 300 | D23: yellow.mkv | E23: of:=[.A24]-[.A23] -> 2 | F23: of:=[.B24]-[.B23] -> 700 | G23: of:=[.C24]-[.C23] -> -280 | H23: of:=[.F23]/[.E23] -> 350 | I23: of:=[.G23]/[.E23] -> -140 | K23: of:="x="&[.B23]&"+(t-"&[.A23]&")*"&ROUND([.H23];3)&":" -> x=900+(t-52)*350: | L23: of:="y="&[.C23]&"+(t-"&[.A23]&")*"&ROUND([.I23];3)&":" -> y=300+(t-52)*-140:
A24: 54 | B24: 1600 | C24: 20 | D24: yellow.mkv | E24: of:=[.A25]-[.A24] -> 2 | F24: of:=[.B25]-[.B24] -> -1400 | G24: of:=[.C25]-[.C24] -> 980 | H24: of:=[.F24]/[.E24] -> -700 | I24: of:=[.G24]/[.E24] -> 490 | K24: of:="x="&[.B24]&"+(t-"&[.A24]&")*"&ROUND([.H24];3)&":" -> x=1600+(t-54)*-700: | L24: of:="y="&[.C24]&"+(t-"&[.A24]&")*"&ROUND([.I24];3)&":" -> y=20+(t-54)*490:
A25: 56 | B25: 200 | C25: 1000 | D25: yellow.mkv | E25: of:=[.A26]-[.A25] -> 2 | F25: of:=[.B26]-[.B25] -> -100 | G25: of:=[.C26]-[.C25] -> -700 | H25: of:=[.F25]/[.E25] -> -50 | I25: of:=[.G25]/[.E25] -> -350 | K25: of:="x="&[.B25]&"+(t-"&[.A25]&")*"&ROUND([.H25];3)&":" -> x=200+(t-56)*-50: | L25: of:="y="&[.C25]&"+(t-"&[.A25]&")*"&ROUND([.I25];3)&":" -> y=1000+(t-56)*-350:
A26: 58 | B26: 100 | C26: 300 | D26: yellow.mkv | E26: of:=[.A27]-[.A26] -> 2 | F26: of:=[.B27]-[.B26] -> -50 | G26: of:=[.C27]-[.C26] -> 100 | H26: of:=[.F26]/[.E26] -> -25 | I26: of:=[.G26]/[.E26] -> 50 | K26: of:="x="&[.B26]&"+(t-"&[.A26]&")*"&ROUND([.H26];3)&":" -> x=100+(t-58)*-25: | L26: of:="y="&[.C26]&"+(t-"&[.A26]&")*"&ROUND([.I26];3)&":" -> y=300+(t-58)*50:
A27: 60 | B27: 50 | C27: 400 | D27: yellow.mkv | E27: of:=[.A28]-[.A27] -> 2 | F27: of:=[.B28]-[.B27] -> 1550 | G27: of:=[.C28]-[.C27] -> -390 | H27: of:=[.F27]/[.E27] -> 775 | I27: of:=[.G27]/[.E27] -> -195 | K27: of:="x="&[.B27]&"+(t-"&[.A27]&")*"&ROUND([.H27];3)&":" -> x=50+(t-60)*775: | L27: of:="y="&[.C27]&"+(t-"&[.A27]&")*"&ROUND([.I27];3)&":" -> y=400+(t-60)*-195:
A28: 62 | B28: 1600 | C28: 10 | D28: yellow.mkv | E28: of:=[.A29]-[.A28] -> 2 | F28: of:=[.B29]-[.B28] -> 300 | G28: of:=[.C29]-[.C28] -> 490 | H28: of:=[.F28]/[.E28] -> 150 | I28: of:=[.G28]/[.E28] -> 245 | K28: of:="x="&[.B28]&"+(t-"&[.A28]&")*"&ROUND([.H28];3)&":" -> x=1600+(t-62)*150: | L28: of:="y="&[.C28]&"+(t-"&[.A28]&")*"&ROUND([.I28];3)&":" -> y=10+(t-62)*245:
A29: 64 | B29: 1900 | C29: 500 | D29: yellow.mkv | E29: of:=[.A30]-[.A29] -> 2 | F29: of:=[.B30]-[.B29] -> -1800 | G29: of:=[.C30]-[.C29] -> 100 | H29: of:=[.F29]/[.E29] -> -900 | I29: of:=[.G29]/[.E29] -> 50 | K29: of:="x="&[.B29]&"+(t-"&[.A29]&")*"&ROUND([.H29];3)&":" -> x=1900+(t-64)*-900: | L29: of:="y="&[.C29]&"+(t-"&[.A29]&")*"&ROUND([.I29];3)&":" -> y=500+(t-64)*50:
A30: 66 | B30: 100 | C30: 600 | D30: yellow.mkv | E30: of:=[.A31]-[.A30] -> 2 | F30: of:=[.B31]-[.B30] -> -80 | G30: of:=[.C31]-[.C30] -> 400 | H30: of:=[.F30]/[.E30] -> -40 | I30: of:=[.G30]/[.E30] -> 200 | K30: of:="x="&[.B30]&"+(t-"&[.A30]&")*"&ROUND([.H30];3)&":" -> x=100+(t-66)*-40: | L30: of:="y="&[.C30]&"+(t-"&[.A30]&")*"&ROUND([.I30];3)&":" -> y=600+(t-66)*200:
A31: 68 | B31: 20 | C31: 1000 | D31: yellow.mkv | E31: of:=[.A32]-[.A31] -> 2 | F31: of:=[.B32]-[.B31] -> 280 | G31: of:=[.C32]-[.C31] -> -400 | H31: of:=[.F31]/[.E31] -> 140 | I31: of:=[.G31]/[.E31] -> -200 | K31: of:="x="&[.B31]&"+(t-"&[.A31]&")*"&ROUND([.H31];3)&":" -> x=20+(t-68)*140: | L31: of:="y="&[.C31]&"+(t-"&[.A31]&")*"&ROUND([.I31];3)&":" -> y=1000+(t-68)*-200:
A32: 70 | B32: 300 | C32: 600 | D32: yellow.mkv | E32: of:=[.A33]-[.A32] -> 2 | F32: of:=[.B33]-[.B32] -> 300 | G32: of:=[.C33]-[.C32] -> -300 | H32: of:=[.F32]/[.E32] -> 150 | I32: of:=[.G32]/[.E32] -> -150 | K32: of:="x="&[.B32]&"+(t-"&[.A32]&")*"&ROUND([.H32];3)&":" -> x=300+(t-70)*150: | L32: of:="y="&[.C32]&"+(t-"&[.A32]&")*"&ROUND([.I32];3)&":" -> y=600+(t-70)*-150:
A33: 72 | B33: 600 | C33: 300 | D33: yellow.mkv | E33: of:=[.A34]-[.A33] -> 2 | F33: of:=[.B34]-[.B33] -> 900 | G33: of:=[.C34]-[.C33] -> 700 | H33: of:=[.F33]/[.E33] -> 450 | I33: of:=[.G33]/[.E33] -> 350 | K33: of:="x="&[.B33]&"+(t-"&[.A33]&")*"&ROUND([.H33];3)&":" -> x=600+(t-72)*450: | L33: of:="y="&[.C33]&"+(t-"&[.A33]&")*"&ROUND([.I33];3)&":" -> y=300+(t-72)*350:
A34: 74 | B34: 1500 | C34: 1000 | D34: yellow.mkv | E34: of:=[.A35]-[.A34] -> 2 | F34: of:=[.B35]-[.B34] -> -1400 | G34: of:=[.C35]-[.C34] -> -950 | H34: of:=[.F34]/[.E34] -> -700 | I34: of:=[.G34]/[.E34] -> -475 | K34: of:="x="&[.B34]&"+(t-"&[.A34]&")*"&ROUND([.H34];3)&":" -> x=1500+(t-74)*-700: | L34: of:="y="&[.C34]&"+(t-"&[.A34]&")*"&ROUND([.I34];3)&":" -> y=1000+(t-74)*-475:
A35: 76 | B35: 100 | C35: 50 | D35: yellow.mkv | E35: of:=[.A36]-[.A35] -> 2 | F35: of:=[.B36]-[.B35] -> 700 | G35: of:=[.C36]-[.C35] -> 550 | H35: of:=[.F35]/[.E35] -> 350 | I35: of:=[.G35]/[.E35] -> 275 | K35: of:="x="&[.B35]&"+(t-"&[.A35]&")*"&ROUND([.H35];3)&":" -> x=100+(t-76)*350: | L35: of:="y="&[.C35]&"+(t-"&[.A35]&")*"&ROUND([.I35];3)&":" -> y=50+(t-76)*275:
A36: 78 | B36: 800 | C36: 600 | D36: yellow.mkv | E36: of:=[.A37]-[.A36] -> 2 | F36: of:=[.B37]-[.B36] -> -400 | G36: of:=[.C37]-[.C36] -> 400 | H36: of:=[.F36]/[.E36] -> -200 | I36: of:=[.G36]/[.E36] -> 200 | K36: of:="x="&[.B36]&"+(t-"&[.A36]&")*"&ROUND([.H36];3)&":" -> x=800+(t-78)*-200: | L36: of:="y="&[.C36]&"+(t-"&[.A36]&")*"&ROUND([.I36];3)&":" -> y=600+(t-78)*200:
A37: 80 | B37: 400 | C37: 1000 | D37: yellow.mkv | E37: of:=[.A38]-[.A37] -> 2 | F37: of:=[.B38]-[.B37] -> 1500 | G37: of:=[.C38]-[.C37] -> -950 | H37: of:=[.F37]/[.E37] -> 750 | I37: of:=[.G37]/[.E37] -> -475 | K37: of:="x="&[.B37]&"+(t-"&[.A37]&")*"&ROUND([.H37];3)&":" -> x=400+(t-80)*750: | L37: of:="y="&[.C37]&"+(t-"&[.A37]&")*"&ROUND([.I37];3)&":" -> y=1000+(t-80)*-475:
A38: 82 | B38: 1900 | C38: 50 | D38: yellow.mkv | E38: of:=[.A39]-[.A38] -> 2 | F38: of:=[.B39]-[.B38] -> -1860 | G38: of:=[.C39]-[.C38] -> 50 | H38: of:=[.F38]/[.E38] -> -930 | I38: of:=[.G38]/[.E38] -> 25 | K38: of:="x="&[.B38]&"+(t-"&[.A38]&")*"&ROUND([.H38];3)&":" -> x=1900+(t-82)*-930: | L38: of:="y="&[.C38]&"+(t-"&[.A38]&")*"&ROUND([.I38];3)&":" -> y=50+(t-82)*25:
A39: 84 | B39: 40 | C39: 100 | D39: yellow.mkv | E39: of:=[.A40]-[.A39] -> 2 | F39: of:=[.B40]-[.B39] -> -40 | G39: of:=[.C40]-[.C39] -> -80 | H39: of:=[.F39]/[.E39] -> -20 | I39: of:=[.G39]/[.E39] -> -40 | K39: of:="x="&[.B39]&"+(t-"&[.A39]&")*"&ROUND([.H39];3)&":" -> x=40+(t-84)*-20: | L39: of:="y="&[.C39]&"+(t-"&[.A39]&")*"&ROUND([.I39];3)&":" -> y=100+(t-84)*-40:
A40: 86 | B40: 0 | C40: 20 | D40: yellow.mkv | E40: of:=[.A41]-[.A40] -> 2 | F40: of:=[.B41]-[.B40] -> 100 | G40: of:=[.C41]-[.C40] -> 980 | H40: of:=[.F40]/[.E40] -> 50 | I40: of:=[.G40]/[.E40] -> 490 | K40: of:="x="&[.B40]&"+(t-"&[.A40]&")*"&ROUND([.H40];3)&":" -> x=0+(t-86)*50: | L40: of:="y="&[.C40]&"+(t-"&[.A40]&")*"&ROUND([.I40];3)&":" -> y=20+(t-86)*490:
A41: 88 | B41: 100 | C41: 1000 | D41: yellow.mkv | E41: of:=[.A42]-[.A41] -> 2 | F41: of:=[.B42]-[.B41] -> 900 | G41: of:=[.C42]-[.C41] -> -100 | H41: of:=[.F41]/[.E41] -> 450 | I41: of:=[.G41]/[.E41] -> -50 | K41: of:="x="&[.B41]&"+(t-"&[.A41]&")*"&ROUND([.H41];3)&":" -> x=100+(t-88)*450: | L41: of:="y="&[.C41]&"+(t-"&[.A41]&")*"&ROUND([.I41];3)&":" -> y=1000+(t-88)*-50:
A42: 90 | B42: 1000 | C42: 900 | D42: yellow.mkv | E42: of:=[.A43]-[.A42] -> 2 | F42: of:=[.B43]-[.B42] -> -900 | G42: of:=[.C43]-[.C42] -> -850 | H42: of:=[.F42]/[.E42] -> -450 | I42: of:=[.G42]/[.E42] -> -425 | K42: of:="x="&[.B42]&"+(t-"&[.A42]&")*"&ROUND([.H42];3)&":" -> x=1000+(t-90)*-450: | L42: of:="y="&[.C42]&"+(t-"&[.A42]&")*"&ROUND([.I42];3)&":" -> y=900+(t-90)*-425:
A43: 92 | B43: 100 | C43: 50 | D43: yellow.mkv | E43: of:=[.A44]-[.A43] -> 2 | F43: of:=[.B44]-[.B43] -> 50 | G43: of:=[.C44]-[.C43] -> 750 | H43: of:=[.F43]/[.E43] -> 25 | I43: of:=[.G43]/[.E43] -> 375 | K43: of:="x="&[.B43]&"+(t-"&[.A43]&")*"&ROUND([.H43];3)&":" -> x=100+(t-92)*25: | L43: of:="y="&[.C43]&"+(t-"&[.A43]&")*"&ROUND([.I43];3)&":" -> y=50+(t-92)*375:
A44: 94 | B44: 150 | C44: 800 | D44: yellow.mkv | E44: of:=[.A45]-[.A44] -> 2 | F44: of:=[.B45]-[.B44] -> 1350 | G44: of:=[.C45]-[.C44] -> -760 | H44: of:=[.F44]/[.E44] -> 675 | I44: of:=[.G44]/[.E44] -> -380 | K44: of:="x="&[.B44]&"+(t-"&[.A44]&")*"&ROUND([.H44];3)&":" -> x=150+(t-94)*675: | L44: of:="y="&[.C44]&"+(t-"&[.A44]&")*"&ROUND([.I44];3)&":" -> y=800+(t-94)*-380:
A45: 96 | B45: 1500 | C45: 40 | D45: yellow.mkv | E45: of:=[.A46]-[.A45] -> 2 | F45: of:=[.B46]-[.B45] -> -900 | G45: of:=[.C46]-[.C45] -> 260 | H45: of:=[.F45]/[.E45] -> -450 | I45: of:=[.G45]/[.E45] -> 130 | K45: of:="x="&[.B45]&"+(t-"&[.A45]&")*"&ROUND([.H45];3)&":" -> x=1500+(t-96)*-450: | L45: of:="y="&[.C45]&"+(t-"&[.A45]&")*"&ROUND([.I45];3)&":" -> y=40+(t-96)*130:
A46: 98 | B46: 600 | C46: 300 | D46: yellow.mkv | E46: of:=[.A47]-[.A46] -> 2 | F46: of:=[.B47]-[.B46] -> -300 | G46: of:=[.C47]-[.C46] -> 300 | H46: of:=[.F46]/[.E46] -> -150 | I46: of:=[.G46]/[.E46] -> 150 | K46: of:="x="&[.B46]&"+(t-"&[.A46]&")*"&ROUND([.H46];3)&":" -> x=600+(t-98)*-150: | L46: of:="y="&[.C46]&"+(t-"&[.A46]&")*"&ROUND([.I46];3)&":" -> y=300+(t-98)*150:
A47: 100 | B47: 300 | C47: 600 | D47: yellow.mkv | E47: of:=[.A48]-[.A47] -> 2 | F47: of:=[.B48]-[.B47] -> 1500 | G47: of:=[.C48]-[.C47] -> 200 | H47: of:=[.F47]/[.E47] -> 750 | I47: of:=[.G47]/[.E47] -> 100 | K47: of:="x="&[.B47]&"+(t-"&[.A47]&")*"&ROUND([.H47];3)&":" -> x=300+(t-100)*750: | L47: of:="y="&[.C47]&"+(t-"&[.A47]&")*"&ROUND([.I47];3)&":" -> y=600+(t-100)*100:
A48: 102 | B48: 1800 | C48: 800 | D48: yellow.mkv | E48: of:=[.A49]-[.A48] -> 2 | F48: of:=[.B49]-[.B48] -> -1600 | G48: of:=[.C49]-[.C48] -> -780 | H48: of:=[.F48]/[.E48] -> -800 | I48: of:=[.G48]/[.E48] -> -390 | K48: of:="x="&[.B48]&"+(t-"&[.A48]&")*"&ROUND([.H48];3)&":" -> x=1800+(t-102)*-800: | L48: of:="y="&[.C48]&"+(t-"&[.A48]&")*"&ROUND([.I48];3)&":" -> y=800+(t-102)*-390:
A49: 104 | B49: 200 | C49: 20 | D49: yellow.mkv | E49: of:=[.A50]-[.A49] -> 2 | F49: of:=[.B50]-[.B49] -> 400 | G49: of:=[.C50]-[.C49] -> 480 | H49: of:=[.F49]/[.E49] -> 200 | I49: of:=[.G49]/[.E49] -> 240 | K49: of:="x="&[.B49]&"+(t-"&[.A49]&")*"&ROUND([.H49];3)&":" -> x=200+(t-104)*200: | L49: of:="y="&[.C49]&"+(t-"&[.A49]&")*"&ROUND([.I49];3)&":" -> y=20+(t-104)*240:
A50: 106 | B50: 600 | C50: 500 | D50: yellow.mkv | E50: of:=[.A51]-[.A50] -> 2 | F50: of:=[.B51]-[.B50] -> -400 | G50: of:=[.C51]-[.C50] -> -200 | H50: of:=[.F50]/[.E50] -> -200 | I50: of:=[.G50]/[.E50] -> -100 | K50: of:="x="&[.B50]&"+(t-"&[.A50]&")*"&ROUND([.H50];3)&":" -> x=600+(t-106)*-200: | L50: of:="y="&[.C50]&"+(t-"&[.A50]&")*"&ROUND([.I50];3)&":" -> y=500+(t-106)*-100:
A51: 108 | B51: 200 | C51: 300 | D51: yellow.mkv | E51: of:=[.A52]-[.A51] -> -108 | F51: of:=[.B52]-[.B51] -> -200 | G51: of:=[.C52]-[.C51] -> -300 | H51: of:=[.F51]/[.E51] -> 1.85185185185185 | I51: of:=[.G51]/[.E51] -> 2.77777777777778 | K51: of:="x="&[.B51]&"+(t-"&[.A51]&")*"&ROUND([.H51];3)&":" -> x=200+(t-108)*1.852: | L51: of:="y="&[.C51]&"+(t-"&[.A51]&")*"&ROUND([.I51];3)&":" -> y=300+(t-108)*2.778:

Sheet: 25_2inputs
A1: input videos name | B1: output video name | E1: copy text below to terminal
A2: bg.mkv | B2: output.mkv | C2: 0 | D2: bg | E2: of:= "ffmpeg -i "&[.A2]&" \" -> ffmpeg -i bg.mkv \
A3: O-vid.mkv | B3: Video size | C3: 1 | D3: 1:v | E3: of:= " -i "&[.A3]&" -filter_complex ""\" ->  -i O-vid.mkv -filter_complex "\
B4: 1920x1080 | C4: 2 | D4: 1:v | E4: of:="nullsrc=size="&[.B4]&" [base];\" -> nullsrc=size=1920x1080 [base];\
C5: 3 | D5: 1:v | E5: of:="[base][0:v] overlay=shortest=1 [tmp1];\" -> [base][0:v] overlay=shortest=1 [tmp1];\
C6: 4 | D6: 1:v | E6: of:=IF([.C4]="";"[tmp"&[.C3]&"]["&[.D3]&"] overlay="&[$x_y_coords.K2]&[$x_y_coords.L2]&"enable='between(t,"&[$x_y_coords.A2]&","&[$x_y_coords.A3]&")'""\";"[tmp"&[.C3]&"]["&[.D3]&"] overlay="&[$x_y_coords.K2]&[$x_y_coords.L2]&"enable='between(t,"&[$x_y_coords.A2]&","&[$x_y_coords.A3]&")'[tmp"&[.C4]&"];\") -> [tmp1][1:v] overlay=x=0+(t-0)*150:y=0+(t-0)*150:enable='between(t,0,4)'[tmp2];\
C7: 5 | D7: 1:v | E7: of:=IF([.C5]="";"[tmp"&[.C4]&"]["&[.D4]&"] overlay="&[$x_y_coords.K3]&[$x_y_coords.L3]&"enable='between(t,"&[$x_y_coords.A3]&","&[$x_y_coords.A4]&")'""\";"[tmp"&[.C4]&"]["&[.D4]&"] overlay="&[$x_y_coords.K3]&[$x_y_coords.L3]&"enable='between(t,"&[$x_y_coords.A3]&","&[$x_y_coords.A4]&")'[tmp"&[.C5]&"];\") -> [tmp2][1:v] overlay=x=600+(t-4)*-100:y=600+(t-4)*-133.333:enable='between(t,4,7)'[tmp3];\
C8: 6 | D8: 1:v | E8: of:=IF([.C6]="";"[tmp"&[.C5]&"]["&[.D5]&"] overlay="&[$x_y_coords.K4]&[$x_y_coords.L4]&"enable='between(t,"&[$x_y_coords.A4]&","&[$x_y_coords.A5]&")'""\";"[tmp"&[.C5]&"]["&[.D5]&"] overlay="&[$x_y_coords.K4]&[$x_y_coords.L4]&"enable='between(t,"&[$x_y_coords.A4]&","&[$x_y_coords.A5]&")'[tmp"&[.C6]&"];\") -> [tmp3][1:v] overlay=x=300+(t-7)*-66.667:y=200+(t-7)*-33.333:enable='between(t,7,10)'[tmp4];\
C9: 7 | D9: 1:v | E9: of:=IF([.C7]="";"[tmp"&[.C6]&"]["&[.D6]&"] overlay="&[$x_y_coords.K5]&[$x_y_coords.L5]&"enable='between(t,"&[$x_y_coords.A5]&","&[$x_y_coords.A6]&")'""\";"[tmp"&[.C6]&"]["&[.D6]&"] overlay="&[$x_y_coords.K5]&[$x_y_coords.L5]&"enable='between(t,"&[$x_y_coords.A5]&","&[$x_y_coords.A6]&")'[tmp"&[.C7]&"];\") -> [tmp4][1:v] overlay=x=100+(t-10)*0:y=100+(t-10)*133.333:enable='between(t,10,13)'[tmp5];\
C10: 8 | D10: 1:v | E10: of:=IF([.C8]="";"[tmp"&[.C7]&"]["&[.D7]&"] overlay="&[$x_y_coords.K6]&[$x_y_coords.L6]&"enable='between(t,"&[$x_y_coords.A6]&","&[$x_y_coords.A7]&")'""\";"[tmp"&[.C7]&"]["&[.D7]&"] overlay="&[$x_y_coords.K6]&[$x_y_coords.L6]&"enable='between(t,"&[$x_y_coords.A6]&","&[$x_y_coords.A7]&")'[tmp"&[.C8]&"];\") -> [tmp5][1:v] overlay=x=100+(t-13)*166.667:y=500+(t-13)*0:enable='between(t,13,16)'[tmp6];\
C11: 9 | D11: 1:v | E11: of:=IF([.C9]="";"[tmp"&[.C8]&"]["&[.D8]&"] overlay="&[$x_y_coords.K7]&[$x_y_coords.L7]&"enable='between(t,"&[$x_y_coords.A7]&","&[$x_y_coords.A8]&")'""\";"[tmp"&[.C8]&"]["&[.D8]&"] overlay="&[$x_y_coords.K7]&[$x_y_coords.L7]&"enable='between(t,"&[$x_y_coords.A7]&","&[$x_y_coords.A8]&")'[tmp"&[.C9]&"];\") -> [tmp6][1:v] overlay=x=600+(t-16)*-50:y=500+(t-16)*-50:enable='between(t,16,18)'[tmp7];\
C12: 10 | D12: 1:v | E12: of:=IF([.C10]="";"[tmp"&[.C9]&"]["&[.D9]&"] overlay="&[$x_y_coords.K8]&[$x_y_coords.L8]&"enable='between(t,"&[$x_y_coords.A8]&","&[$x_y_coords.A9]&")'""\";"[tmp"&[.C9]&"]["&[.D9]&"] overlay="&[$x_y_coords.K8]&[$x_y_coords.L8]&"enable='between(t,"&[$x_y_coords.A8]&","&[$x_y_coords.A9]&")'[tmp"&[.C10]&"];\") -> [tmp7][1:v] overlay=x=500+(t-18)*-50:y=400+(t-18)*-50:enable='between(t,18,22)'[tmp8];\
C13: 11 | D13: 1:v | E13: of:=IF([.C11]="";"[tmp"&[.C10]&"]["&[.D10]&"] overlay="&[$x_y_coords.K9]&[$x_y_coords.L9]&"enable='between(t,"&[$x_y_coords.A9]&","&[$x_y_coords.A10]&")'""\";"[tmp"&[.C10]&"]["&[.D10]&"] overlay="&[$x_y_coords.K9]&[$x_y_coords.L9]&"enable='between(t,"&[$x_y_coords.A9]&","&[$x_y_coords.A10]&")'[tmp"&[.C11]&"];\") -> [tmp8][1:v] overlay=x=300+(t-22)*33.333:y=200+(t-22)*-33.333:enable='between(t,22,25)'[tmp9];\
C14: 12 | D14: 1:v | E14: of:=IF([.C12]="";"[tmp"&[.C11]&"]["&[.D11]&"] overlay="&[$x_y_coords.K10]&[$x_y_coords.L10]&"enable='between(t,"&[$x_y_coords.A10]&","&[$x_y_coords.A11]&")'""\";"[tmp"&[.C11]&"]["&[.D11]&"] overlay="&[$x_y_coords.K10]&[$x_y_coords.L10]&"enable='between(t,"&[$x_y_coords.A10]&","&[$x_y_coords.A11]&")'[tmp"&[.C12]&"];\") -> [tmp9][1:v] overlay=x=400+(t-25)*-50:y=100+(t-25)*0:enable='between(t,25,28)'[tmp10];\
C15: 13 | D15: 1:v | E15: of:=IF([.C13]="";"[tmp"&[.C12]&"]["&[.D12]&"] overlay="&[$x_y_coords.K11]&[$x_y_coords.L11]&"enable='between(t,"&[$x_y_coords.A11]&","&[$x_y_coords.A12]&")'""\";"[tmp"&[.C12]&"]["&[.D12]&"] overlay="&[$x_y_coords.K11]&[$x_y_coords.L11]&"enable='between(t,"&[$x_y_coords.A11]&","&[$x_y_coords.A12]&")'[tmp"&[.C13]&"];\") -> [tmp10][1:v] overlay=x=250+(t-28)*-50:y=100+(t-28)*133.333:enable='between(t,28,31)'[tmp11];\
C16: 14 | D16: 1:v | E16: of:=IF([.C14]="";"[tmp"&[.C13]&"]["&[.D13]&"] overlay="&[$x_y_coords.K12]&[$x_y_coords.L12]&"enable='between(t,"&[$x_y_coords.A12]&","&[$x_y_coords.A13]&")'""\";"[tmp"&[.C13]&"]["&[.D13]&"] overlay="&[$x_y_coords.K12]&[$x_y_coords.L12]&"enable='between(t,"&[$x_y_coords.A12]&","&[$x_y_coords.A13]&")'[tmp"&[.C14]&"];\") -> [tmp11][1:v] overlay=x=100+(t-31)*200:y=500+(t-31)*100:enable='between(t,31,32)'[tmp12];\
C17: 15 | D17: 1:v | E17: of:=IF([.C15]="";"[tmp"&[.C14]&"]["&[.D14]&"] overlay="&[$x_y_coords.K13]&[$x_y_coords.L13]&"enable='between(t,"&[$x_y_coords.A13]&","&[$x_y_coords.A14]&")'""\";"[tmp"&[.C14]&"]["&[.D14]&"] overlay="&[$x_y_coords.K13]&[$x_y_coords.L13]&"enable='between(t,"&[$x_y_coords.A13]&","&[$x_y_coords.A14]&")'[tmp"&[.C15]&"];\") -> [tmp12][1:v] overlay=x=300+(t-32)*300:y=600+(t-32)*-200:enable='between(t,32,34)'[tmp13];\
C18: 16 | D18: 1:v | E18: of:=IF([.C16]="";"[tmp"&[.C15]&"]["&[.D15]&"] overlay="&[$x_y_coords.K14]&[$x_y_coords.L14]&"enable='between(t,"&[$x_y_coords.A14]&","&[$x_y_coords.A15]&")'""\";"[tmp"&[.C15]&"]["&[.D15]&"] overlay="&[$x_y_coords.K14]&[$x_y_coords.L14]&"enable='between(t,"&[$x_y_coords.A14]&","&[$x_y_coords.A15]&")'[tmp"&[.C16]&"];\") -> [tmp13][1:v] overlay=x=900+(t-34)*-150:y=200+(t-34)*-50:enable='between(t,34,36)'[tmp14];\
C19: 17 | D19: 1:v | E19: of:=IF([.C17]="";"[tmp"&[.C16]&"]["&[.D16]&"] overlay="&[$x_y_coords.K15]&[$x_y_coords.L15]&"enable='between(t,"&[$x_y_coords.A15]&","&[$x_y_coords.A16]&")'""\";"[tmp"&[.C16]&"]["&[.D16]&"] overlay="&[$x_y_coords.K15]&[$x_y_coords.L15]&"enable='between(t,"&[$x_y_coords.A15]&","&[$x_y_coords.A16]&")'[tmp"&[.C17]&"];\") -> [tmp14][1:v] overlay=x=600+(t-36)*200:y=100+(t-36)*350:enable='between(t,36,38)'[tmp15];\
C20: 18 | D20: 1:v | E20: of:=IF([.C18]="";"[tmp"&[.C17]&"]["&[.D17]&"] overlay="&[$x_y_coords.K16]&[$x_y_coords.L16]&"enable='between(t,"&[$x_y_coords.A16]&","&[$x_y_coords.A17]&")'""\";"[tmp"&[.C17]&"]["&[.D17]&"] overlay="&[$x_y_coords.K16]&[$x_y_coords.L16]&"enable='between(t,"&[$x_y_coords.A16]&","&[$x_y_coords.A17]&")'[tmp"&[.C18]&"];\") -> [tmp15][1:v] overlay=x=1000+(t-38)*400:y=800+(t-38)*100:enable='between(t,38,40)'[tmp16];\
C21: 19 | D21: 1:v | E21: of:=IF([.C19]="";"[tmp"&[.C18]&"]["&[.D18]&"] overlay="&[$x_y_coords.K17]&[$x_y_coords.L17]&"enable='between(t,"&[$x_y_coords.A17]&","&[$x_y_coords.A18]&")'""\";"[tmp"&[.C18]&"]["&[.D18]&"] overlay="&[$x_y_coords.K17]&[$x_y_coords.L17]&"enable='between(t,"&[$x_y_coords.A17]&","&[$x_y_coords.A18]&")'[tmp"&[.C19]&"];\") -> [tmp16][1:v] overlay=x=1800+(t-40)*-850:y=1000+(t-40)*-495:enable='between(t,40,42)'[tmp17];\
C22: 20 | D22: 1:v | E22: of:=IF([.C20]="";"[tmp"&[.C19]&"]["&[.D19]&"] overlay="&[$x_y_coords.K18]&[$x_y_coords.L18]&"enable='between(t,"&[$x_y_coords.A18]&","&[$x_y_coords.A19]&")'""\";"[tmp"&[.C19]&"]["&[.D19]&"] overlay="&[$x_y_coords.K18]&[$x_y_coords.L18]&"enable='between(t,"&[$x_y_coords.A18]&","&[$x_y_coords.A19]&")'[tmp"&[.C20]&"];\") -> [tmp17][1:v] overlay=x=100+(t-42)*700:y=10+(t-42)*445:enable='between(t,42,44)'[tmp18];\
C23: 21 | D23: 1:v | E23: of:=IF([.C21]="";"[tmp"&[.C20]&"]["&[.D20]&"] overlay="&[$x_y_coords.K19]&[$x_y_coords.L19]&"enable='between(t,"&[$x_y_coords.A19]&","&[$x_y_coords.A20]&")'""\";"[tmp"&[.C20]&"]["&[.D20]&"] overlay="&[$x_y_coords.K19]&[$x_y_coords.L19]&"enable='between(t,"&[$x_y_coords.A19]&","&[$x_y_coords.A20]&")'[tmp"&[.C21]&"];\") -> [tmp18][1:v] overlay=x=1500+(t-44)*-650:y=900+(t-44)*-445:enable='between(t,44,46)'[tmp19];\
C24: 22 | D24: 1:v | E24: of:=IF([.C22]="";"[tmp"&[.C21]&"]["&[.D21]&"] overlay="&[$x_y_coords.K20]&[$x_y_coords.L20]&"enable='between(t,"&[$x_y_coords.A20]&","&[$x_y_coords.A21]&")'""\";"[tmp"&[.C21]&"]["&[.D21]&"] overlay="&[$x_y_coords.K20]&[$x_y_coords.L20]&"enable='between(t,"&[$x_y_coords.A20]&","&[$x_y_coords.A21]&")'[tmp"&[.C22]&"];\") -> [tmp19][1:v] overlay=x=200+(t-46)*50:y=10+(t-46)*95:enable='between(t,46,48)'[tmp20];\
C25: 23 | D25: 1:v | E25: of:=IF([.C23]="";"[tmp"&[.C22]&"]["&[.D22]&"] overlay="&[$x_y_coords.K21]&[$x_y_coords.L21]&"enable='between(t,"&[$x_y_coords.A21]&","&[$x_y_coords.A22]&")'""\";"[tmp"&[.C22]&"]["&[.D22]&"] overlay="&[$x_y_coords.K21]&[$x_y_coords.L21]&"enable='between(t,"&[$x_y_coords.A21]&","&[$x_y_coords.A22]&")'[tmp"&[.C23]&"];\") -> [tmp20][1:v] overlay=x=300+(t-48)*150:y=200+(t-48)*300:enable='between(t,48,50)'[tmp21];\
C26: 24 | D26: 1:v | E26: of:=IF([.C24]="";"[tmp"&[.C23]&"]["&[.D23]&"] overlay="&[$x_y_coords.K22]&[$x_y_coords.L22]&"enable='between(t,"&[$x_y_coords.A22]&","&[$x_y_coords.A23]&")'""\";"[tmp"&[.C23]&"]["&[.D23]&"] overlay="&[$x_y_coords.K22]&[$x_y_coords.L22]&"enable='between(t,"&[$x_y_coords.A22]&","&[$x_y_coords.A23]&")'[tmp"&[.C24]&"];\") -> [tmp21][1:v] overlay=x=600+(t-50)*150:y=800+(t-50)*-250:enable='between(t,50,52)'[tmp22];\
E27: of:=IF([.C25]="";"[tmp"&[.C24]&"]["&[.D24]&"] overlay="&[$x_y_coords.K23]&[$x_y_coords.L23]&"enable='between(t,"&[$x_y_coords.A23]&","&[$x_y_coords.A24]&")'""\";"[tmp"&[.C24]&"]["&[.D24]&"] overlay="&[$x_y_coords.K23]&[$x_y_coords.L23]&"enable='between(t,"&[$x_y_coords.A23]&","&[$x_y_coords.A24]&")'[tmp"&[.C25]&"];\") -> [tmp22][1:v] overlay=x=900+(t-52)*350:y=300+(t-52)*-140:enable='between(t,52,54)'[tmp23];\
E28: of:=IF([.C26]="";"[tmp"&[.C25]&"]["&[.D25]&"] overlay="&[$x_y_coords.K24]&[$x_y_coords.L24]&"enable='between(t,"&[$x_y_coords.A24]&","&[$x_y_coords.A25]&")'""\";"[tmp"&[.C25]&"]["&[.D25]&"] overlay="&[$x_y_coords.K24]&[$x_y_coords.L24]&"enable='between(t,"&[$x_y_coords.A24]&","&[$x_y_coords.A25]&")'[tmp"&[.C26]&"];\") -> [tmp23][1:v] overlay=x=1600+(t-54)*-700:y=20+(t-54)*490:enable='between(t,54,56)'[tmp24];\
E29: of:=IF([.C27]="";"[tmp"&[.C26]&"]["&[.D26]&"] overlay="&[$x_y_coords.K25]&[$x_y_coords.L25]&"enable='between(t,"&[$x_y_coords.A25]&","&[$x_y_coords.A26]&")'""\";"[tmp"&[.C26]&"]["&[.D26]&"] overlay="&[$x_y_coords.K25]&[$x_y_coords.L25]&"enable='between(t,"&[$x_y_coords.A25]&","&[$x_y_coords.A26]&")'[tmp"&[.C27]&"];\") -> [tmp24][1:v] overlay=x=200+(t-56)*-50:y=1000+(t-56)*-350:enable='between(t,56,58)'"\
E30: of:=" -c:v libx264 "&[.B2] ->  -c:v libx264 output.mkv

Sheet: 25_moves_25_vids
A1: input videos name | B1: scale? | C1: Delay start time? | D1: output video name | G1: copy text below to terminal
A2: blank.mkv | D2: 26moves.mkv | E2: 0 | F2: bg | G2: of:= "ffmpeg -i "&[.A2]&" \" -> ffmpeg -i blank.mkv \
A3: yellow.mkv | C3: 0 | E3: 1 | F3: f1 | G3: of:= " -i "&[.A3]&" \" ->  -i yellow.mkv \
A4: output.mov | C4: 4 | D4: 1920x1080 | E4: 2 | F4: f2 | G4: of:= " -i "&[.A4]&" \" ->  -i output.mov \
A5: blue.mkv | C5: 7 | E5: 3 | F5: f3 | G5: of:= " -i "&[.A5]&" \" ->  -i blue.mkv \
A6: yellow.mkv | B6: 300:300: | C6: 10 | E6: 4 | F6: f4 | G6: of:= " -i "&[.A6]&" \" ->  -i yellow.mkv \
A7: pink.mkv | C7: 13 | E7: 5 | F7: f5 | G7: of:= " -i "&[.A7]&" \" ->  -i pink.mkv \
A8: yellow.mkv | C8: 16 | E8: 6 | F8: f6 | G8: of:= " -i "&[.A8]&" \" ->  -i yellow.mkv \
A9: output.mov | C9: 18 | E9: 7 | F9: f7 | G9: of:= " -i "&[.A9]&" \" ->  -i output.mov \
A10: yellow.mkv | C10: 22 | E10: 8 | F10: f8 | G10: of:= " -i "&[.A10]&" \" ->  -i yellow.mkv \
A11: output.mov | C11: 25 | E11: 9 | F11: f9 | G11: of:= " -i "&[.A11]&" \" ->  -i output.mov \
A12: yellow.mkv | C12: 28 | E12: 10 | F12: f10 | G12: of:= " -i "&[.A12]&" \" ->  -i yellow.mkv \
A13: output.mov | C13: 31 | E13: 11 | F13: f11 | G13: of:= " -i "&[.A13]&" \" ->  -i output.mov \
A14: yellow.mkv | C14: 32 | E14: 12 | F14: f12 | G14: of:= " -i "&[.A14]&" \" ->  -i yellow.mkv \
A15: output.mov | C15: 34 | E15: 13 | F15: f13 | G15: of:= " -i "&[.A15]&" \" ->  -i output.mov \
A16: yellow.mkv | C16: 36 | E16: 14 | F16: f14 | G16: of:= " -i "&[.A16]&" \" ->  -i yellow.mkv \
A17: yellow.mkv | C17: 38 | E17: 15 | F17: f15 | G17: of:= " -i "&[.A17]&" \" ->  -i yellow.mkv \
A18: output.mov | C18: 40 | E18: 16 | F18: f16 | G18: of:= " -i "&[.A18]&" \" ->  -i output.mov \
A19: pink.mkv | C19: 42 | E19: 17 | F19: f17 | G19: of:= " -i "&[.A19]&" \" ->  -i pink.mkv \
A20: output.mov | C20: 44 | E20: 18 | F20: f18 | G20: of:= " -i "&[.A20]&" \" ->  -i output.mov \
A21: output.mov | C21: 46 | E21: 19 | F21: f19 | G21: of:= " -i "&[.A21]&" \" ->  -i output.mov \
A22: blue.mkv | C22: 48 | E22: 20 | F22: f20 | G22: of:= " -i "&[.A22]&" \" ->  -i blue.mkv \
A23: yellow.mkv | C23: 50 | E23: 21 | F23: f21 | G23: of:= " -i "&[.A23]&" \" ->  -i yellow.mkv \
A24: output.mov | C24: 52 | E24: 22 | F24: f22 | G24: of:= " -i "&[.A24]&" \" ->  -i output.mov \
A25: output.mov | C25: 54 | E25: 23 | F25: f23 | G25: of:= " -i "&[.A25]&" \" ->  -i output.mov \
A26: yellow.mkv | C26: 56 | E26: 24 | F26: f24 | G26: of:= " -i "&[.A26]&" -filter_complex ""\" ->  -i yellow.mkv -filter_complex "\
G27: of:="nullsrc=size="&[.D4]&" [base];\" -> nullsrc=size=1920x1080 [base];\
G28: of:=IF([.C2]="";"["&[.E2]&":v] setpts=PTS-STARTPTS";"["&[.E2]&":v] setpts=PTS+"&[.C2]&"/TB")&IF([.B2]="";" ["&[.F2]&"];\";" ,scale="&[.B2]&" ["&[.F2]&"];\") -> [0:v] setpts=PTS-STARTPTS [bg];\
G29: of:=IF([.C3]="";"["&[.E3]&":v] setpts=PTS-STARTPTS";"["&[.E3]&":v] setpts=PTS+"&[.C3]&"/TB")&IF([.B3]="";" ["&[.F3]&"];\";" ,scale="&[.B3]&" ["&[.F3]&"];\") -> [1:v] setpts=PTS+0/TB [f1];\
G30: of:=IF([.C4]="";"["&[.E4]&":v] setpts=PTS-STARTPTS";"["&[.E4]&":v] setpts=PTS+"&[.C4]&"/TB")&IF([.B4]="";" ["&[.F4]&"];\";" ,scale="&[.B4]&" ["&[.F4]&"];\") -> [2:v] setpts=PTS+4/TB [f2];\
G31: of:=IF([.C5]="";"["&[.E5]&":v] setpts=PTS-STARTPTS";"["&[.E5]&":v] setpts=PTS+"&[.C5]&"/TB")&IF([.B5]="";" ["&[.F5]&"];\";" ,scale="&[.B5]&" ["&[.F5]&"];\") -> [3:v] setpts=PTS+7/TB [f3];\
G32: of:=IF([.C6]="";"["&[.E6]&":v] setpts=PTS-STARTPTS";"["&[.E6]&":v] setpts=PTS+"&[.C6]&"/TB")&IF([.B6]="";" ["&[.F6]&"];\";" ,scale="&[.B6]&" ["&[.F6]&"];\") -> [4:v] setpts=PTS+10/TB ,scale=300:300: [f4];\
G33: of:=IF([.C7]="";"["&[.E7]&":v] setpts=PTS-STARTPTS";"["&[.E7]&":v] setpts=PTS+"&[.C7]&"/TB")&IF([.B7]="";" ["&[.F7]&"];\";" ,scale="&[.B7]&" ["&[.F7]&"];\") -> [5:v] setpts=PTS+13/TB [f5];\
G34: of:=IF([.C8]="";"["&[.E8]&":v] setpts=PTS-STARTPTS";"["&[.E8]&":v] setpts=PTS+"&[.C8]&"/TB")&IF([.B8]="";" ["&[.F8]&"];\";" ,scale="&[.B8]&" ["&[.F8]&"];\") -> [6:v] setpts=PTS+16/TB [f6];\
G35: of:=IF([.C9]="";"["&[.E9]&":v] setpts=PTS-STARTPTS";"["&[.E9]&":v] setpts=PTS+"&[.C9]&"/TB")&IF([.B9]="";" ["&[.F9]&"];\";" ,scale="&[.B9]&" ["&[.F9]&"];\") -> [7:v] setpts=PTS+18/TB [f7];\
G36: of:=IF([.C10]="";"["&[.E10]&":v] setpts=PTS-STARTPTS";"["&[.E10]&":v] setpts=PTS+"&[.C10]&"/TB")&IF([.B10]="";" ["&[.F10]&"];\";" ,scale="&[.B10]&" ["&[.F10]&"];\") -> [8:v] setpts=PTS+22/TB [f8];\
G37: of:=IF([.C11]="";"["&[.E11]&":v] setpts=PTS-STARTPTS";"["&[.E11]&":v] setpts=PTS+"&[.C11]&"/TB")&IF([.B11]="";" ["&[.F11]&"];\";" ,scale="&[.B11]&" ["&[.F11]&"];\") -> [9:v] setpts=PTS+25/TB [f9];\
G38: of:=IF([.C12]="";"["&[.E12]&":v] setpts=PTS-STARTPTS";"["&[.E12]&":v] setpts=PTS+"&[.C12]&"/TB")&IF([.B12]="";" ["&[.F12]&"];\";" ,scale="&[.B12]&" ["&[.F12]&"];\") -> [10:v] setpts=PTS+28/TB [f10];\
G39: of:=IF([.C13]="";"["&[.E13]&":v] setpts=PTS-STARTPTS";"["&[.E13]&":v] setpts=PTS+"&[.C13]&"/TB")&IF([.B13]="";" ["&[.F13]&"];\";" ,scale="&[.B13]&" ["&[.F13]&"];\") -> [11:v] setpts=PTS+31/TB [f11];\
G40: of:=IF([.C14]="";"["&[.E14]&":v] setpts=PTS-STARTPTS";"["&[.E14]&":v] setpts=PTS+"&[.C14]&"/TB")&IF([.B14]="";" ["&[.F14]&"];\";" ,scale="&[.B14]&" ["&[.F14]&"];\") -> [12:v] setpts=PTS+32/TB [f12];\
G41: of:=IF([.C15]="";"["&[.E15]&":v] setpts=PTS-STARTPTS";"["&[.E15]&":v] setpts=PTS+"&[.C15]&"/TB")&IF([.B15]="";" ["&[.F15]&"];\";" ,scale="&[.B15]&" ["&[.F15]&"];\") -> [13:v] setpts=PTS+34/TB [f13];\
G42: of:=IF([.C16]="";"["&[.E16]&":v] setpts=PTS-STARTPTS";"["&[.E16]&":v] setpts=PTS+"&[.C16]&"/TB")&IF([.B16]="";" ["&[.F16]&"];\";" ,scale="&[.B16]&" ["&[.F16]&"];\") -> [14:v] setpts=PTS+36/TB [f14];\
G43: of:=IF([.C17]="";"["&[.E17]&":v] setpts=PTS-STARTPTS";"["&[.E17]&":v] setpts=PTS+"&[.C17]&"/TB")&IF([.B17]="";" ["&[.F17]&"];\";" ,scale="&[.B17]&" ["&[.F17]&"];\") -> [15:v] setpts=PTS+38/TB [f15];\
G44: of:=IF([.C18]="";"["&[.E18]&":v] setpts=PTS-STARTPTS";"["&[.E18]&":v] setpts=PTS+"&[.C18]&"/TB")&IF([.B18]="";" ["&[.F18]&"];\";" ,scale="&[.B18]&" ["&[.F18]&"];\") -> [16:v] setpts=PTS+40/TB [f16];\
G45: of:=IF([.C19]="";"["&[.E19]&":v] setpts=PTS-STARTPTS";"["&[.E19]&":v] setpts=PTS+"&[.C19]&"/TB")&IF([.B19]="";" ["&[.F19]&"];\";" ,scale="&[.B19]&" ["&[.F19]&"];\") -> [17:v] setpts=PTS+42/TB [f17];\
G46: of:=IF([.C20]="";"["&[.E20]&":v] setpts=PTS-STARTPTS";"["&[.E20]&":v] setpts=PTS+"&[.C20]&"/TB")&IF([.B20]="";" ["&[.F20]&"];\";" ,scale="&[.B20]&" ["&[.F20]&"];\") -> [18:v] setpts=PTS+44/TB [f18];\
G47: of:=IF([.C21]="";"["&[.E21]&":v] setpts=PTS-STARTPTS";"["&[.E21]&":v] setpts=PTS+"&[.C21]&"/TB")&IF([.B21]="";" ["&[.F21]&"];\";" ,scale="&[.B21]&" ["&[.F21]&"];\") -> [19:v] setpts=PTS+46/TB [f19];\
G48: of:=IF([.C22]="";"["&[.E22]&":v] setpts=PTS-STARTPTS";"["&[.E22]&":v] setpts=PTS+"&[.C22]&"/TB")&IF([.B22]="";" ["&[.F22]&"];\";" ,scale="&[.B22]&" ["&[.F22]&"];\") -> [20:v] setpts=PTS+48/TB [f20];\
G49: of:=IF([.C23]="";"["&[.E23]&":v] setpts=PTS-STARTPTS";"["&[.E23]&":v] setpts=PTS+"&[.C23]&"/TB")&IF([.B23]="";" ["&[.F23]&"];\";" ,scale="&[.B23]&" ["&[.F23]&"];\") -> [21:v] setpts=PTS+50/TB [f21];\
G50: of:=IF([.C24]="";"["&[.E24]&":v] setpts=PTS-STARTPTS";"["&[.E24]&":v] setpts=PTS+"&[.C24]&"/TB")&IF([.B24]="";" ["&[.F24]&"];\";" ,scale="&[.B24]&" ["&[.F24]&"];\") -> [22:v] setpts=PTS+52/TB [f22];\
G51: of:=IF([.C25]="";"["&[.E25]&":v] setpts=PTS-STARTPTS";"["&[.E25]&":v] setpts=PTS+"&[.C25]&"/TB")&IF([.B25]="";" ["&[.F25]&"];\";" ,scale="&[.B25]&" ["&[.F25]&"];\") -> [23:v] setpts=PTS+54/TB [f23];\
G52: of:=IF([.C26]="";"["&[.E26]&":v] setpts=PTS-STARTPTS";"["&[.E26]&":v] setpts=PTS+"&[.C26]&"/TB")&IF([.B26]="";" ["&[.F26]&"];\";" ,scale="&[.B26]&" ["&[.F26]&"];\") -> [24:v] setpts=PTS+56/TB [f24];\
G53: of:="[base][bg] overlay=shortest=1 [tmp1];\" -> [base][bg] overlay=shortest=1 [tmp1];\
G54: of:=IF([.E4]="";"[tmp"&[.E3]&"]["&[.F3]&"] overlay="&[$x_y_coords.K2]&[$x_y_coords.L2]&"enable='between(t,"&[$x_y_coords.A2]&","&[$x_y_coords.A3]&")'""\";"[tmp"&[.E3]&"]["&[.F3]&"] overlay="&[$x_y_coords.K2]&[$x_y_coords.L2]&"enable='between(t,"&[$x_y_coords.A2]&","&[$x_y_coords.A3]&")'[tmp"&[.E4]&"];\") -> [tmp1][f1] overlay=x=0+(t-0)*150:y=0+(t-0)*150:enable='between(t,0,4)'[tmp2];\
G55: of:=IF([.E5]="";"[tmp"&[.E4]&"]["&[.F4]&"] overlay="&[$x_y_coords.K3]&[$x_y_coords.L3]&"enable='between(t,"&[$x_y_coords.A3]&","&[$x_y_coords.A4]&")'""\";"[tmp"&[.E4]&"]["&[.F4]&"] overlay="&[$x_y_coords.K3]&[$x_y_coords.L3]&"enable='between(t,"&[$x_y_coords.A3]&","&[$x_y_coords.A4]&")'[tmp"&[.E5]&"];\") -> [tmp2][f2] overlay=x=600+(t-4)*-100:y=600+(t-4)*-133.333:enable='between(t,4,7)'[tmp3];\
G56: of:=IF([.E6]="";"[tmp"&[.E5]&"]["&[.F5]&"] overlay="&[$x_y_coords.K4]&[$x_y_coords.L4]&"enable='between(t,"&[$x_y_coords.A4]&","&[$x_y_coords.A5]&")'""\";"[tmp"&[.E5]&"]["&[.F5]&"] overlay="&[$x_y_coords.K4]&[$x_y_coords.L4]&"enable='between(t,"&[$x_y_coords.A4]&","&[$x_y_coords.A5]&")'[tmp"&[.E6]&"];\") -> [tmp3][f3] overlay=x=300+(t-7)*-66.667:y=200+(t-7)*-33.333:enable='between(t,7,10)'[tmp4];\
G57: of:=IF([.E7]="";"[tmp"&[.E6]&"]["&[.F6]&"] overlay="&[$x_y_coords.K5]&[$x_y_coords.L5]&"enable='between(t,"&[$x_y_coords.A5]&","&[$x_y_coords.A6]&")'""\";"[tmp"&[.E6]&"]["&[.F6]&"] overlay="&[$x_y_coords.K5]&[$x_y_coords.L5]&"enable='between(t,"&[$x_y_coords.A5]&","&[$x_y_coords.A6]&")'[tmp"&[.E7]&"];\") -> [tmp4][f4] overlay=x=100+(t-10)*0:y=100+(t-10)*133.333:enable='between(t,10,13)'[tmp5];\
G58: of:=IF([.E8]="";"[tmp"&[.E7]&"]["&[.F7]&"] overlay="&[$x_y_coords.K6]&[$x_y_coords.L6]&"enable='between(t,"&[$x_y_coords.A6]&","&[$x_y_coords.A7]&")'""\";"[tmp"&[.E7]&"]["&[.F7]&"] overlay="&[$x_y_coords.K6]&[$x_y_coords.L6]&"enable='between(t,"&[$x_y_coords.A6]&","&[$x_y_coords.A7]&")'[tmp"&[.E8]&"];\") -> [tmp5][f5] overlay=x=100+(t-13)*166.667:y=500+(t-13)*0:enable='between(t,13,16)'[tmp6];\
G59: of:=IF([.E9]="";"[tmp"&[.E8]&"]["&[.F8]&"] overlay="&[$x_y_coords.K7]&[$x_y_coords.L7]&"enable='between(t,"&[$x_y_coords.A7]&","&[$x_y_coords.A8]&")'""\";"[tmp"&[.E8]&"]["&[.F8]&"] overlay="&[$x_y_coords.K7]&[$x_y_coords.L7]&"enable='between(t,"&[$x_y_coords.A7]&","&[$x_y_coords.A8]&")'[tmp"&[.E9]&"];\") -> [tmp6][f6] overlay=x=600+(t-16)*-50:y=500+(t-16)*-50:enable='between(t,16,18)'[tmp7];\
G60: of:=IF([.E10]="";"[tmp"&[.E9]&"]["&[.F9]&"] overlay="&[$x_y_coords.K8]&[$x_y_coords.L8]&"enable='between(t,"&[$x_y_coords.A8]&","&[$x_y_coords.A9]&")'""\";"[tmp"&[.E9]&"]["&[.F9]&"] overlay="&[$x_y_coords.K8]&[$x_y_coords.L8]&"enable='between(t,"&[$x_y_coords.A8]&","&[$x_y_coords.A9]&")'[tmp"&[.E10]&"];\") -> [tmp7][f7] overlay=x=500+(t-18)*-50:y=400+(t-18)*-50:enable='between(t,18,22)'[tmp8];\
G61: of:=IF([.E11]="";"[tmp"&[.E10]&"]["&[.F10]&"] overlay="&[$x_y_coords.K9]&[$x_y_coords.L9]&"enable='between(t,"&[$x_y_coords.A9]&","&[$x_y_coords.A10]&")'""\";"[tmp"&[.E10]&"]["&[.F10]&"] overlay="&[$x_y_coords.K9]&[$x_y_coords.L9]&"enable='between(t,"&[$x_y_coords.A9]&","&[$x_y_coords.A10]&")'[tmp"&[.E11]&"];\") -> [tmp8][f8] overlay=x=300+(t-22)*33.333:y=200+(t-22)*-33.333:enable='between(t,22,25)'[tmp9];\
G62: of:=IF([.E12]="";"[tmp"&[.E11]&"]["&[.F11]&"] overlay="&[$x_y_coords.K10]&[$x_y_coords.L10]&"enable='between(t,"&[$x_y_coords.A10]&","&[$x_y_coords.A11]&")'""\";"[tmp"&[.E11]&"]["&[.F11]&"] overlay="&[$x_y_coords.K10]&[$x_y_coords.L10]&"enable='between(t,"&[$x_y_coords.A10]&","&[$x_y_coords.A11]&")'[tmp"&[.E12]&"];\") -> [tmp9][f9] overlay=x=400+(t-25)*-50:y=100+(t-25)*0:enable='between(t,25,28)'[tmp10];\
G63: of:=IF([.E13]="";"[tmp"&[.E12]&"]["&[.F12]&"] overlay="&[$x_y_coords.K11]&[$x_y_coords.L11]&"enable='between(t,"&[$x_y_coords.A11]&","&[$x_y_coords.A12]&")'""\";"[tmp"&[.E12]&"]["&[.F12]&"] overlay="&[$x_y_coords.K11]&[$x_y_coords.L11]&"enable='between(t,"&[$x_y_coords.A11]&","&[$x_y_coords.A12]&")'[tmp"&[.E13]&"];\") -> [tmp10][f10] overlay=x=250+(t-28)*-50:y=100+(t-28)*133.333:enable='between(t,28,31)'[tmp11];\
G64: of:=IF([.E14]="";"[tmp"&[.E13]&"]["&[.F13]&"] overlay="&[$x_y_coords.K12]&[$x_y_coords.L12]&"enable='between(t,"&[$x_y_coords.A12]&","&[$x_y_coords.A13]&")'""\";"[tmp"&[.E13]&"]["&[.F13]&"] overlay="&[$x_y_coords.K12]&[$x_y_coords.L12]&"enable='between(t,"&[$x_y_coords.A12]&","&[$x_y_coords.A13]&")'[tmp"&[.E14]&"];\") -> [tmp11][f11] overlay=x=100+(t-31)*200:y=500+(t-31)*100:enable='between(t,31,32)'[tmp12];\
G65: of:=IF([.E15]="";"[tmp"&[.E14]&"]["&[.F14]&"] overlay="&[$x_y_coords.K13]&[$x_y_coords.L13]&"enable='between(t,"&[$x_y_coords.A13]&","&[$x_y_coords.A14]&")'""\";"[tmp"&[.E14]&"]["&[.F14]&"] overlay="&[$x_y_coords.K13]&[$x_y_coords.L13]&"enable='between(t,"&[$x_y_coords.A13]&","&[$x_y_coords.A14]&")'[tmp"&[.E15]&"];\") -> [tmp12][f12] overlay=x=300+(t-32)*300:y=600+(t-32)*-200:enable='between(t,32,34)'[tmp13];\
G66: of:=IF([.E16]="";"[tmp"&[.E15]&"]["&[.F15]&"] overlay="&[$x_y_coords.K14]&[$x_y_coords.L14]&"enable='between(t,"&[$x_y_coords.A14]&","&[$x_y_coords.A15]&")'""\";"[tmp"&[.E15]&"]["&[.F15]&"] overlay="&[$x_y_coords.K14]&[$x_y_coords.L14]&"enable='between(t,"&[$x_y_coords.A14]&","&[$x_y_coords.A15]&")'[tmp"&[.E16]&"];\") -> [tmp13][f13] overlay=x=900+(t-34)*-150:y=200+(t-34)*-50:enable='between(t,34,36)'[tmp14];\
G67: of:=IF([.E17]="";"[tmp"&[.E16]&"]["&[.F16]&"] overlay="&[$x_y_coords.K15]&[$x_y_coords.L15]&"enable='between(t,"&[$x_y_coords.A15]&","&[$x_y_coords.A16]&")'""\";"[tmp"&[.E16]&"]["&[.F16]&"] overlay="&[$x_y_coords.K15]&[$x_y_coords.L15]&"enable='between(t,"&[$x_y_coords.A15]&","&[$x_y_coords.A16]&")'[tmp"&[.E17]&"];\") -> [tmp14][f14] overlay=x=600+(t-36)*200:y=100+(t-36)*350:enable='between(t,36,38)'[tmp15];\
G68: of:=IF([.E18]="";"[tmp"&[.E17]&"]["&[.F17]&"] overlay="&[$x_y_coords.K16]&[$x_y_coords.L16]&"enable='between(t,"&[$x_y_coords.A16]&","&[$x_y_coords.A17]&")'""\";"[tmp"&[.E17]&"]["&[.F17]&"] overlay="&[$x_y_coords.K16]&[$x_y_coords.L16]&"enable='between(t,"&[$x_y_coords.A16]&","&[$x_y_coords.A17]&")'[tmp"&[.E18]&"];\") -> [tmp15][f15] overlay=x=1000+(t-38)*400:y=800+(t-38)*100:enable='between(t,38,40)'[tmp16];\
G69: of:=IF([.E19]="";"[tmp"&[.E18]&"]["&[.F18]&"] overlay="&[$x_y_coords.K17]&[$x_y_coords.L17]&"enable='between(t,"&[$x_y_coords.A17]&","&[$x_y_coords.A18]&")'""\";"[tmp"&[.E18]&"]["&[.F18]&"] overlay="&[$x_y_coords.K17]&[$x_y_coords.L17]&"enable='between(t,"&[$x_y_coords.A17]&","&[$x_y_coords.A18]&")'[tmp"&[.E19]&"];\") -> [tmp16][f16] overlay=x=1800+(t-40)*-850:y=1000+(t-40)*-495:enable='between(t,40,42)'[tmp17];\
G70: of:=IF([.E20]="";"[tmp"&[.E19]&"]["&[.F19]&"] overlay="&[$x_y_coords.K18]&[$x_y_coords.L18]&"enable='between(t,"&[$x_y_coords.A18]&","&[$x_y_coords.A19]&")'""\";"[tmp"&[.E19]&"]["&[.F19]&"] overlay="&[$x_y_coords.K18]&[$x_y_coords.L18]&"enable='between(t,"&[$x_y_coords.A18]&","&[$x_y_coords.A19]&")'[tmp"&[.E20]&"];\") -> [tmp17][f17] overlay=x=100+(t-42)*700:y=10+(t-42)*445:enable='between(t,42,44)'[tmp18];\
G71: of:=IF([.E21]="";"[tmp"&[.E20]&"]["&[.F20]&"] overlay="&[$x_y_coords.K19]&[$x_y_coords.L19]&"enable='between(t,"&[$x_y_coords.A19]&","&[$x_y_coords.A20]&")'""\";"[tmp"&[.E20]&"]["&[.F20]&"] overlay="&[$x_y_coords.K19]&[$x_y_coords.L19]&"enable='between(t,"&[$x_y_coords.A19]&","&[$x_y_coords.A20]&")'[tmp"&[.E21]&"];\") -> [tmp18][f18] overlay=x=1500+(t-44)*-650:y=900+(t-44)*-445:enable='between(t,44,46)'[tmp19];\
G72: of:=IF([.E22]="";"[tmp"&[.E21]&"]["&[.F21]&"] overlay="&[$x_y_coords.K20]&[$x_y_coords.L20]&"enable='between(t,"&[$x_y_coords.A20]&","&[$x_y_coords.A21]&")'""\";"[tmp"&[.E21]&"]["&[.F21]&"] overlay="&[$x_y_coords.K20]&[$x_y_coords.L20]&"enable='between(t,"&[$x_y_coords.A20]&","&[$x_y_coords.A21]&")'[tmp"&[.E22]&"];\") -> [tmp19][f19] overlay=x=200+(t-46)*50:y=10+(t-46)*95:enable='between(t,46,48)'[tmp20];\
G73: of:=IF([.E23]="";"[tmp"&[.E22]&"]["&[.F22]&"] overlay="&[$x_y_coords.K21]&[$x_y_coords.L21]&"enable='between(t,"&[$x_y_coords.A21]&","&[$x_y_coords.A22]&")'""\";"[tmp"&[.E22]&"]["&[.F22]&"] overlay="&[$x_y_coords.K21]&[$x_y_coords.L21]&"enable='between(t,"&[$x_y_coords.A21]&","&[$x_y_coords.A22]&")'[tmp"&[.E23]&"];\") -> [tmp20][f20] overlay=x=300+(t-48)*150:y=200+(t-48)*300:enable='between(t,48,50)'[tmp21];\
G74: of:=IF([.E24]="";"[tmp"&[.E23]&"]["&[.F23]&"] overlay="&[$x_y_coords.K22]&[$x_y_coords.L22]&"enable='between(t,"&[$x_y_coords.A22]&","&[$x_y_coords.A23]&")'""\";"[tmp"&[.E23]&"]["&[.F23]&"] overlay="&[$x_y_coords.K22]&[$x_y_coords.L22]&"enable='between(t,"&[$x_y_coords.A22]&","&[$x_y_coords.A23]&")'[tmp"&[.E24]&"];\") -> [tmp21][f21] overlay=x=600+(t-50)*150:y=800+(t-50)*-250:enable='between(t,50,52)'[tmp22];\
G75: of:=IF([.E25]="";"[tmp"&[.E24]&"]["&[.F24]&"] overlay="&[$x_y_coords.K23]&[$x_y_coords.L23]&"enable='between(t,"&[$x_y_coords.A23]&","&[$x_y_coords.A24]&")'""\";"[tmp"&[.E24]&"]["&[.F24]&"] overlay="&[$x_y_coords.K23]&[$x_y_coords.L23]&"enable='between(t,"&[$x_y_coords.A23]&","&[$x_y_coords.A24]&")'[tmp"&[.E25]&"];\") -> [tmp22][f22] overlay=x=900+(t-52)*350:y=300+(t-52)*-140:enable='between(t,52,54)'[tmp23];\
G76: of:=IF([.E26]="";"[tmp"&[.E25]&"]["&[.F25]&"] overlay="&[$x_y_coords.K24]&[$x_y_coords.L24]&"enable='between(t,"&[$x_y_coords.A24]&","&[$x_y_coords.A25]&")'""\";"[tmp"&[.E25]&"]["&[.F25]&"] overlay="&[$x_y_coords.K24]&[$x_y_coords.L24]&"enable='between(t,"&[$x_y_coords.A24]&","&[$x_y_coords.A25]&")'[tmp"&[.E26]&"];\") -> [tmp23][f23] overlay=x=1600+(t-54)*-700:y=20+(t-54)*490:enable='between(t,54,56)'[tmp24];\
G77: of:=IF([.E27]="";"[tmp"&[.E26]&"]["&[.F26]&"] overlay="&[$x_y_coords.K25]&[$x_y_coords.L25]&"enable='between(t,"&[$x_y_coords.A25]&","&[$x_y_coords.A26]&")'""\";"[tmp"&[.E26]&"]["&[.F26]&"] overlay="&[$x_y_coords.K25]&[$x_y_coords.L25]&"enable='between(t,"&[$x_y_coords.A25]&","&[$x_y_coords.A26]&")'[tmp"&[.E27]&"];\") -> [tmp24][f24] overlay=x=200+(t-56)*-50:y=1000+(t-56)*-350:enable='between(t,56,58)'"\
G78: of:=" -c:v libx264 "&[.D2] ->  -c:v libx264 26moves.mkv